{
  "source": "confluence:6497338582",
  "structure": "Confluence page 'Live Animals & Germinals Data Fields - V4', version 201, fetched to workareas/shared/design-release-2-1/sources/6497338582.json (result.body is storage-format HTML on a single line, ~160 KB). Sections in order, with byte offsets into result.body: h2 'Live Animal Data Elements' (offset 750; intro notes on 'Applies at' and the three data levels Notification / Commodity line / Unit, then one large field table to 80408); h1 'Reason of Import' (80474, table to 100240); h1 'Animal Identifiers' (100306, table to 117195); h1 'Documents' (117232, table to 130668); h2 'Germinal Data Elements' (130705: intro paragraph 'applies to germinal products only - semen, embryos and ova ... at least one germinal identifier per animal', then one field table 131054-142625 with 7 rows and no header row of its own, its columns matching the page's other field tables: Field name, Attributes, Validation, Applies at (with 'Applicable to' commodity-code lists), Source, Mandatory, Example, Impacts; then a note 'Not required for germinal products: County Parish Holding (CPH) and Permanent Address'); h1 anchor 'address_block' / 'Address Block' (142865, inside the germinal section, a Standard Address Block table 143528-154371 with a header row Field Name | Attributes | Validation | Example | Impacts and 10 rows, each tagged ANIMALS and GERMINALS); h2 'Out of Scope Data Elements' (154437, table 154525-159780, columns Field Name | Notes | Date, 6 rows plus an empty row, of which 2 name germinals: 'Approved Establishment - germinals' and 'Package type - germinals', both 'de-scoped by' with no name or date given). The scope takes in only the Germinal Data Elements section through the Address Block table, plus the 2 germinal rows of the Out of Scope table: about 29 KB of the body, 17 field rows and 2 out-of-scope rows. Left out: the Live Animal Data Elements, Reason of Import, Animal Identifiers and Documents sections and the 4 non-germinal out-of-scope rows (Arrival time at port, Journey Log, Transport after BCP, Animal Identifier - Wing Ring). The page shows no status macro or decision log. A tag-stripped text copy of the body from the Germinal Data Elements heading to the end is at distil/extract/confluence-6497338582.work/germinal-to-end.txt (rows end in @@ROW@@, cells separated by |).\n\nExtracted in 1 part:\nPart 1, Germinal Data Elements, Address Block and germinal out-of-scope rows: Part 1 of 1 of Confluence page 'Live Animals & Germinals Data Fields - V4', version 201 (no status macro, no decision log). Read in full from the raw storage HTML of result.body (byte range 130600-160500, cut to work/part1/germinal.html), not only the tag-stripped helper copy, which drops user mentions and dates. Sections read: (1) h2 'Germinal Data Elements': intro paragraph (germinal products only - semen, embryos and ova; at least one germinal identifier per animal), then one full-width field table of 7 rows with NO header row, 8 columns matching the page's other field tables (Field Name | Type/Attributes | Conditions / Values | Applies at | Source | Mandatory | Example | Impacts). Rows: Total gross weight (kg), Quantity (unit/pieces), Temperature, Donor name/ID, Collection date, Production date, Identification Number/Mark. Five rows (Temperature and the four Unit Level rows) carry a collapsed 'Applicable to' expand macro in the Applies-at cell listing the same 12 commodity code/name entries; Total gross weight and Quantity carry none. Every row's Source is 'User' and Impacts is the GERMINALS status tag. Then a note: CPH and Permanent Address are not required for germinal products. (2) h1 'Address Block' (anchor address_block), nested under the germinal section: intro paragraph, then a table with header Field Name | Attributes | Validation | Example | Impacts and 10 rows, each tagged ANIMALS and GERMINALS; the Validation column holds only Mandatory/Optional. (3) h2 'Out of Scope Data Elements': table Field Name | Notes | Date; only its two germinal rows claimed (Approved Establishment - germinals, Package type - germinals), each 'de-scoped by' a Confluence user mention with a date of 2026-09-07 in the raw HTML. The four non-germinal rows and the trailing empty row are another scope's. Context read but not claimed: the page-top note ('All fields apply to both the animal and germinal journeys...'), the Live Animal Data Elements note defining 'Applies at' and Levels 1-3, and that table's header row used to name the germinal table's columns. Inline comment markers on 'Total gross weight (kg)' and 'Package type - germinals' point at comments the fetched body does not contain.",
  "scopeHash": "5f44fe03a9064ee74ba87008136365cfefc4694bfe108643f3dab60544c60250",
  "claims": [
    {
      "id": "confluence-6497338582-p1-001",
      "statement": "The Germinal Data Elements section defines data elements that apply to germinal products only.",
      "kind": "rule",
      "ref": "§Germinal Data Elements, intro paragraph",
      "quote": "This section defines the data elements that apply to germinal products only",
      "confidence": "verbatim"
    },
    {
      "id": "confluence-6497338582-p1-002",
      "statement": "Germinal products are semen, embryos and ova.",
      "kind": "data",
      "ref": "§Germinal Data Elements, intro paragraph",
      "quote": "semen, embryos and ova",
      "confidence": "verbatim"
    },
    {
      "id": "confluence-6497338582-p1-003",
      "statement": "A germinal products notification must be submitted with at least one germinal identifier per animal.",
      "kind": "rule",
      "ref": "§Germinal Data Elements, intro paragraph",
      "quote": "A notification must be submitted with at least one germinal identifier per animal",
      "confidence": "verbatim",
      "note": "Ambiguous: germinal products are not animals, and every Unit Level field in the table below is marked Optional. See the gap claim that follows."
    },
    {
      "id": "confluence-6497338582-p1-004",
      "statement": "The page does not say which fields count as a 'germinal identifier' for the at-least-one rule, what 'per animal' means for semen, embryos and ova (per commodity line, per unit or per donor), or at which point the rule is enforced (to proceed or at submit). All four Unit Level identifier fields (Donor name/ID, Collection date, Production date, Identification Number/Mark) are marked Optional, which on its own would let a notification be submitted with none.",
      "kind": "rule",
      "ref": "§Germinal Data Elements, intro paragraph against the field table's Mandatory column",
      "quote": "",
      "confidence": "gap"
    },
    {
      "id": "confluence-6497338582-p1-005",
      "statement": "The germinal field table has no header row of its own; its column meanings are not stated in the section and can only be read from the page's other field tables (Field Name, Type, Conditions / Values, Applies at, Source, Mandatory, Example, Impacts).",
      "kind": "data",
      "ref": "§Germinal Data Elements, field table (first row is 'Total gross weight (kg)', not a header)",
      "quote": "",
      "confidence": "gap",
      "note": "Column names in the other claims for this table come from the Live Animal Data Elements table header, read for context."
    },
    {
      "id": "confluence-6497338582-p1-006",
      "statement": "A germinal products notification captures the total gross weight of the consignment, in kilograms, as a number.",
      "kind": "data",
      "ref": "§Germinal Data Elements, field table, row 'Total gross weight (kg)', columns Field Name and Type",
      "quote": "Total gross weight (kg) | numeric:",
      "confidence": "verbatim"
    },
    {
      "id": "confluence-6497338582-p1-007",
      "statement": "Total gross weight (kg) has a maximum of 1,000.",
      "kind": "rule",
      "ref": "§Germinal Data Elements, field table, row 'Total gross weight (kg)', column Type",
      "quote": "Max: 1,000",
      "confidence": "verbatim",
      "note": "Whether 1,000 itself is allowed (inclusive maximum) is not stated."
    },
    {
      "id": "confluence-6497338582-p1-008",
      "statement": "Total gross weight (kg) must be greater than 0.",
      "kind": "rule",
      "ref": "§Germinal Data Elements, field table, row 'Total gross weight (kg)', column Type",
      "quote": "Min: &gt; 0",
      "confidence": "verbatim",
      "note": "Quoted as stored in the page body; it renders as 'Min: > 0'."
    },
    {
      "id": "confluence-6497338582-p1-009",
      "statement": "Total gross weight (kg) is given to 2 decimal places.",
      "kind": "rule",
      "ref": "§Germinal Data Elements, field table, row 'Total gross weight (kg)', column Type",
      "quote": "2 decimal places",
      "confidence": "verbatim",
      "note": "Whether this means at most two decimal places or exactly two is not stated; the example 24.50 shows two."
    },
    {
      "id": "confluence-6497338582-p1-010",
      "statement": "Total gross weight (kg) is entered once for the whole germinal notification (Notification level), not per commodity line.",
      "kind": "data",
      "ref": "§Germinal Data Elements, field table, row 'Total gross weight (kg)', column Applies at",
      "quote": "Notification level",
      "confidence": "verbatim"
    },
    {
      "id": "confluence-6497338582-p1-011",
      "statement": "Total gross weight (kg) is optional for a germinal products notification.",
      "kind": "rule",
      "ref": "§Germinal Data Elements, field table, row 'Total gross weight (kg)', column Mandatory",
      "quote": "Optional",
      "confidence": "verbatim"
    },
    {
      "id": "confluence-6497338582-p1-012",
      "statement": "The example value for Total gross weight (kg) is 24.50.",
      "kind": "data",
      "ref": "§Germinal Data Elements, field table, row 'Total gross weight (kg)', column Example",
      "quote": "24.50",
      "confidence": "verbatim"
    },